,secs_stamp,text,max_sentiment,anger,anticipation,disgust,fear,joy,sadness,surprise,trust
816,3312,They got Thanos.,Neutral,0,0,0,0,0,0,0,0
817,3314,You get me...,Neutral,0,0,0,0,0,0,0,0
818,3321,You're done hurting people.,anger,1,0,0,1,0,1,0,0
819,3324,WE hurt people?,anger,1,0,0,1,0,1,0,0
820,3329,You're crazy!,anger,1,0,0,1,0,1,0,0
821,3361,Wait! Help me!,anticipation,0,1,0,0,0,0,0,0
822,3363,I'll give you anything!,anger,1,0,1,1,0,1,0,0
823,3366,What do you want?,Neutral,0,0,0,0,0,0,0,0
824,3367,What I want you can't give me.,Neutral,0,0,0,0,0,0,0,0
825,3394,You shouldn't be here.,Neutral,0,0,0,0,0,0,0,0
826,3398,Neither should you.,Neutral,0,0,0,0,0,0,0,0
827,3406,I've got a job to do.,Neutral,0,0,0,0,0,0,0,0
828,3409,Is that what you're calling this?,Neutral,0,0,0,0,0,0,0,0
829,3411,Killing all these people isn't gonna bring your family back.,fear,0,0,0,1,0,1,0,0
830,3420,We found something.,Neutral,0,0,0,0,0,0,0,0
831,3423,"A chance, maybe.",surprise,0,0,0,0,0,0,1,0
832,3428,Don't.,Neutral,0,0,0,0,0,0,0,0
833,3430,Don't what?,Neutral,0,0,0,0,0,0,0,0
834,3435,Don't give me hope.,anticipation,0,1,0,0,1,0,1,1
835,3439,I'm sorry I couldn't give it to you sooner.,Neutral,0,0,0,0,0,0,0,0
836,3463,You're drifting left.,sadness,0,0,0,0,0,1,1,0
837,3465,"One side there, Lebowski.",Neutral,0,0,0,0,0,0,0,0
838,3470,"Ratchet, how's it going?",Neutral,0,0,0,0,0,0,0,0
839,3472,It's Rocket.,anger,1,0,0,0,0,0,0,0
840,3473,"Take it easy. You're only a genius on Earth, pal.",Neutral,0,0,0,0,0,0,0,0
841,3480,"Time travel suit, not bad.",anger,1,1,1,1,0,1,0,0
842,3483,"Hey, hey, hey! Easy! Easy!",Neutral,0,0,0,0,0,0,0,0
843,3485,I'm being very careful.,Neutral,0,0,0,0,0,0,0,0
844,3486,"No, you're being very Hulky.",Neutral,0,0,0,0,0,0,0,0
845,3488,I'm being careful.,Neutral,0,0,0,0,0,0,0,0
846,3489,"These are Pym Particles, all right?",Neutral,0,0,0,0,0,0,0,0
847,3490,"And ever since Hank Pym got snapped out of existence, this is it.",Neutral,0,0,0,0,0,0,0,0
848,3493,This is what we have. We're not making any more.,Neutral,0,0,0,0,0,0,0,0
849,3495,"- Scott, calm down. - Sorry.",Neutral,0,0,0,0,0,0,0,0
850,3497,We've got enough for one round-trip each. That's it.,Neutral,0,0,0,0,0,0,0,0
851,3500,No do-overs.,Neutral,0,0,0,0,0,0,0,0
852,3502,Plus two test runs.,Neutral,0,0,0,0,0,0,0,0
853,3508,One test run.,Neutral,0,0,0,0,0,0,0,0
854,3510,All right. I'm not ready for this.,anticipation,0,1,0,0,0,0,0,0
855,3512,I'm game.,Neutral,0,0,0,0,0,0,0,0
856,3515,I'll do it.,anger,1,0,1,1,0,1,0,0
857,3518,"Clint, now you're gonna feel a little discombobulated from the chronoshift.",Neutral,0,0,0,0,0,0,0,0
858,3521,- Don't worry about that. - Wait a second. Let me ask you something.,anticipation,0,2,0,1,0,1,0,0
859,3523,"If we can do this, you know...",Neutral,0,0,0,0,0,0,0,0
860,3525,"go back in time, why don't we just find baby Thanos?",anticipation,0,1,0,0,1,0,0,0
861,3527,"You know, and...",Neutral,0,0,0,0,0,0,0,0
862,3532,"- First of all, that's horrible. - It's Thanos.",anger,1,0,1,1,0,0,0,0
863,3534,"And secondly, time doesn't work that way.",anticipation,0,1,0,0,0,0,0,0
864,3537,Changing the past doesn't change the future.,fear,0,0,0,2,0,0,0,0
865,3539,"Look, we go back, we get the stones before Thanos gets them...",anger,1,0,0,0,0,0,0,0
866,3542,Thanos doesn't have the stones. Problem solved.,anger,1,0,0,1,0,1,0,0
867,3545,- Bingo. - That's not how it works.,Neutral,0,0,0,0,0,0,0,0
868,3547,"- Well, that's what I heard. - Wait, but who? Who told you that?",anticipation,0,1,0,0,0,0,0,0
869,3549,"Star Trek, Terminator, Timecop...",anticipation,0,1,0,0,1,0,0,1
870,3551,- Time After Time. - Quantum Leap.,anticipation,0,2,0,0,0,0,0,0
871,3553,"- Wrinkle in Time, Somewhere in Time. - Hot Tub Time Machine.",anticipation,1,3,0,0,0,0,0,1
872,3555,Hot Tub Time Machine. Bill and Ted's Excellent Adventure.,anticipation,1,2,0,0,1,0,0,2
873,3558,"Basically, any movie that deals with time travel.",anticipation,0,2,0,0,1,0,1,1
874,3560,"Die Hard. No, that's not one.",fear,0,0,0,1,0,1,0,0
875,3562,This is known.,Neutral,0,0,0,0,0,0,0,0
876,3563,"I don't know why everyone believes that, but that isn't true.",Neutral,0,0,0,0,0,0,0,0
877,3566,Think about it. If you travel to the past...,Neutral,0,0,0,0,0,0,0,0
878,3568,that past becomes your future...,Neutral,0,0,0,0,0,0,0,0
879,3570,and your former present becomes the past...,anticipation,0,1,0,0,1,0,1,1
880,3573,which can't now be changed by your new future.,fear,0,0,0,1,0,0,0,0
881,3576,Exactly.,Neutral,0,0,0,0,0,0,0,0
882,3578,So Back to the Future is a bunch of bullshit?,Neutral,0,0,0,0,0,0,0,0
883,3585,"All right, Clint.",Neutral,0,0,0,0,0,0,0,0
884,3587,"We're going in three, two...",Neutral,0,0,0,0,0,0,0,0
885,3590,one.,Neutral,0,0,0,0,0,0,0,0
886,3664,Cooper?,Neutral,0,0,0,0,0,0,0,0
887,3665,Where are my headphones?,Neutral,0,0,0,0,0,0,0,0
888,3667,Lila?,Neutral,0,0,0,0,0,0,0,0
889,3668,- I never had them. - Lila?,Neutral,0,0,0,0,0,0,0,0
890,3671,"Yeah, you had them yesterday!",Neutral,0,0,0,0,0,0,0,0
891,3673,Lila! Lila!,Neutral,0,0,0,0,0,0,0,0
892,3680,"Yeah, Dad?",Neutral,0,0,0,0,0,0,0,0
893,3685,Dad?,Neutral,0,0,0,0,0,0,0,0
894,3688,Lila!,Neutral,0,0,0,0,0,0,0,0
895,3696,"Hey. Hey, look at me.",Neutral,0,0,0,0,0,0,0,0
896,3698,You okay?,Neutral,0,0,0,0,0,0,0,0
897,3700,Yeah. Yeah.,Neutral,0,0,0,0,0,0,0,0
898,3704,It worked.,Neutral,0,0,0,0,0,0,0,0
899,3707,It worked.,Neutral,0,0,0,0,0,0,0,0
900,3711,"Okay, so the how works.",Neutral,0,0,0,0,0,0,0,0
901,3714,"Now, we got to figure out the when and the where.",Neutral,0,0,0,0,0,0,0,0
902,3718,Almost everyone in this room has had an encounter...,Neutral,0,0,0,0,0,0,0,0
903,3720,with at least one of the six Infinity Stones.,anger,1,1,0,0,1,0,0,1
904,3722,"Or substitute the word ""encounter""...",trust,0,0,0,0,0,0,0,1
905,3723,"for ""damn near been killed"" by one of the six Infinity Stones.",anger,2,1,1,1,1,1,0,1
906,3726,"Well, I haven't...",Neutral,0,0,0,0,0,0,0,0
907,3727,but I don't even know what the hell you're all talking about.,anger,1,0,1,1,0,1,0,0
908,3730,"Regardless, we only have enough Pym Particles for one round-trip each.",Neutral,0,0,0,0,0,0,0,0
909,3735,And these stones have been in a lot of different places throughout history.,anger,1,0,0,0,0,0,0,0
910,3738,Our history.,Neutral,0,0,0,0,0,0,0,0
911,3740,"So, not a lot of convenient spots to just drop in, yeah?",Neutral,0,0,0,0,0,0,0,0
912,3743,Which means we have to pick our targets.,Neutral,0,0,0,0,0,0,0,0
913,3745,Correct.,Neutral,0,0,0,0,0,0,0,0
914,3748,"So, let's start with the Aether.",anticipation,0,1,0,0,0,0,0,0
915,3749,"Thor, what do you know?",Neutral,0,0,0,0,0,0,0,0
916,3756,Is he asleep?,Neutral,0,0,0,0,0,0,0,0
917,3758,"No, no. I'm pretty sure he's dead.",anticipation,0,1,0,0,1,0,0,1
918,3764,Where to start?,anticipation,0,1,0,0,0,0,0,0
919,3767,"The Aether, firstly, is not a stone.",anger,1,0,0,0,0,0,0,0
920,3770,Someone called it a stone before.,anger,1,0,0,0,0,0,0,0
921,3773,It's more of an angry sludge sort of a thing...,disgust,1,0,2,0,0,0,0,0
922,3777,so someone's gonna need to amend that and stop saying that.,Neutral,0,0,0,0,0,0,0,0
923,3780,"Here's an interesting story, though, about the Aether.",Neutral,0,0,0,0,0,0,0,0
924,3783,"My grandfather, many years ago...",trust,0,0,0,0,0,0,0,1
925,3785,had to hide the stone from the Dark Elves.,anger,1,0,0,1,0,1,0,0
926,3790,Scary beings.,Neutral,0,0,0,0,0,0,0,0
927,3792,"So, Jane, actually...",Neutral,0,0,0,0,0,0,0,0
928,3794,"Oh, there she is.",Neutral,0,0,0,0,0,0,0,0
929,3796,"Yeah, so Jane was an old flame of mine.",Neutral,0,0,0,0,0,0,0,0
930,3800,"You know, she stuck her hand inside a rock this one time...",anticipation,0,1,0,0,0,0,0,0
931,3804,and then the Aether stuck itself inside her...,Neutral,0,0,0,0,0,0,0,0
932,3807,"and she became very, very sick.",disgust,0,0,1,0,0,1,0,0
933,3809,"And so I had to take her to Asgard, which is where I'm from...",Neutral,0,0,0,0,0,0,0,0
934,3812,and we had to try and fix her.,Neutral,0,0,0,0,0,0,0,0
935,3814,"We were dating at the time, you see...",anticipation,0,1,0,0,0,0,0,0
936,3816,and I got to introduce her to my mother...,anticipation,0,1,0,0,1,1,0,1
937,3821,who's dead and...,Neutral,0,0,0,0,0,0,0,0
938,3824,"Oh, you know, Jane and I aren't even dating anymore, so...",Neutral,0,0,0,0,0,0,0,0
939,3829,"Yes, these things happen, though. You know?",anticipation,0,1,0,0,0,0,0,0
940,3830,Nothing lasts forever. The only thing that...,Neutral,0,0,0,0,0,0,0,0
941,3832,- Why don't you come sit down? - I'm not done yet.,Neutral,0,0,0,0,0,0,0,0
942,3834,The only thing that is permanent in life is impermanence.,Neutral,0,0,0,0,0,0,0,0
943,3837,Awesome. Eggs? Breakfast?,Neutral,0,0,0,0,0,0,0,0
944,3840,No. I'd like a Bloody Mary.,anger,1,0,1,1,0,1,0,0
945,3842,Quill said he stole the Power Stone from Morag.,anger,2,0,0,1,0,1,0,0
946,3845,"- Is that a person? - No, Morag's a planet.",Neutral,0,0,0,0,0,0,0,0
947,3849,Quill was a person.,Neutral,0,0,0,0,0,0,0,0
948,3851,Like a planet? Like in outer space?,Neutral,0,0,0,0,0,0,0,0
949,3853,"Oh, look. It's like a little puppy, all happy and everything.",anticipation,0,2,0,0,1,0,0,2
950,3858,"Do you wanna go to space? You wanna go to space, puppy?",fear,0,1,0,2,0,2,0,1
951,3861,I'll take you to space.,anger,1,0,1,1,0,1,0,0
952,3864,Thanos found the Soul Stone on Vormir.,anger,1,0,0,0,0,0,0,0
953,3866,What is Vormir?,Neutral,0,0,0,0,0,0,0,0
954,3868,A dominion of death...,fear,1,1,1,2,0,1,1,1
955,3870,at the very center of celestial existence.,anticipation,0,1,0,0,1,0,0,1
956,3873,It's where Thanos murdered my sister.,anger,1,0,1,1,0,1,1,0
957,3884,Not it.,Neutral,0,0,0,0,0,0,0,0
958,3887,- That Time Stone guy. - Doctor Strange.,anger,1,1,0,0,0,0,0,1
959,3888,"Yeah, what kind of doctor was he?",trust,0,0,0,0,1,0,0,2
960,3890,Ear-nose-throat meets rabbit-from-hat.,Neutral,0,0,0,0,0,0,0,0
961,3893,"Nice place in the Village, though.",Neutral,0,0,0,0,0,0,0,0
962,3894,"Yeah, on Sullivan Street?",Neutral,0,0,0,0,0,0,0,0
963,3896,Bleecker Street.,Neutral,0,0,0,0,0,0,0,0
964,3897,"Wait, he lived in New York?",anticipation,0,1,0,0,0,0,0,0
965,3899,"- No, he lived in Toronto. - Yeah, on Bleecker and Sullivan.",Neutral,0,0,0,0,0,0,0,0
966,3901,- Have you been listening to anything? - Guys.,Neutral,0,0,0,0,0,0,0,0
967,3903,"If you pick the right year, there are three stones in New York.",anger,1,0,0,0,0,0,0,0
968,3909,Shut the front door.,Neutral,0,0,0,0,0,0,0,0
969,3913,All right. We have a plan.,anticipation,0,1,0,0,0,0,0,0
970,3916,"Six stones, three teams, one shot.",anger,2,0,0,1,0,0,0,1
971,3930,"Five years ago, we lost.",anger,1,0,1,1,0,1,1,0
972,3933,All of us.,Neutral,0,0,0,0,0,0,0,0
973,3936,We lost friends.,anger,1,0,1,1,0,1,1,0
974,3938,We lost family.,anger,1,0,1,1,0,1,1,0
975,3942,We lost a part of ourselves.,anger,1,0,1,1,0,1,1,0
976,3945,"Today, we have a chance to take it all back.",surprise,0,0,0,0,0,0,1,0
977,3949,You know your teams. You know your missions.,trust,0,0,0,0,0,0,0,1
978,3953,Get the stones. Get them back.,anger,1,0,0,0,0,0,0,0
979,3956,One round-trip each.,Neutral,0,0,0,0,0,0,0,0
980,3957,No mistakes...,sadness,0,0,0,0,0,1,0,0
981,3958,no do-overs.,Neutral,0,0,0,0,0,0,0,0
982,3960,Most of us are going somewhere we know.,Neutral,0,0,0,0,0,0,0,0
983,3962,That doesn't mean we should know what to expect.,anticipation,0,1,0,0,0,0,1,1
984,3965,Be careful.,Neutral,0,0,0,0,0,0,0,0
985,3967,Look out for each other.,Neutral,0,0,0,0,0,0,0,0
986,3970,This is the fight of our lives...,anger,1,0,0,1,0,0,0,0
987,3972,and we're gonna win.,Neutral,0,0,0,0,0,0,0,0
988,3976,Whatever it takes.,Neutral,0,0,0,0,0,0,0,0
989,3980,Good luck.,anticipation,0,2,0,0,2,0,2,1
990,3982,He's pretty good at that.,anticipation,0,2,0,0,2,0,1,2
991,3983,- Right? - All right.,Neutral,0,0,0,0,0,0,0,0
992,3985,"You heard the man. Stroke those keys, Jolly Green.",fear,0,0,0,1,1,1,0,1
993,3988,Trackers engaged.,Neutral,0,0,0,0,0,0,0,0
994,3990,"You promise to bring that back in one piece, right?",joy,0,0,0,0,1,0,0,1
995,3992,"Yeah, yeah, yeah.",Neutral,0,0,0,0,0,0,0,0
996,3994,"Okay, I'll do my best.",anger,1,0,1,1,0,1,0,0
997,3996,"As promises go, that was pretty lame.",joy,0,1,0,0,2,0,0,2
998,4001,See ya in a minute.,Neutral,0,0,0,0,0,0,0,0
999,4056,"All right, we all have our assignments.",Neutral,0,0,0,0,0,0,0,0
1000,4058,"Two stones uptown, one stone down.",anger,2,0,0,0,0,0,0,0
1001,4060,Stay low. Keep an eye on the clock.,anticipation,0,1,0,0,0,0,0,0
1002,4077,Maybe smash a few things along the way.,anger,1,0,0,1,0,0,0,0
1003,4080,"I think it's gratuitous, but whatever.",disgust,0,0,1,0,0,0,0,0
1004,4110,I'd be careful going that way. We just had the floors waxed.,Neutral,0,0,0,0,0,0,0,0
1005,4119,"Yeah, I'm looking for Doctor Strange.",trust,0,0,0,0,0,0,0,1
1006,4122,You're about five years too early.,Neutral,0,0,0,0,0,0,0,0
1007,4126,Stephen Strange is currently performing surgery about 20 blocks that way.,fear,0,0,0,1,0,1,0,0
1008,4131,What do you want from him?,Neutral,0,0,0,0,0,0,0,0
1009,4133,"That, actually.",Neutral,0,0,0,0,0,0,0,0
1010,4137,I'm afraid not.,fear,0,0,0,1,0,0,0,0
1011,4139,"Sorry, but I wasn't asking.",Neutral,0,0,0,0,0,0,0,0
1012,4141,You don't want to do this.,Neutral,0,0,0,0,0,0,0,0
1013,4142,"You're right, I don't. But I need that stone...",anger,1,0,0,0,0,0,0,0
1014,4144,and I don't have time to debate it.,anticipation,0,1,0,0,0,0,0,0
1015,4154,"Let's start over, shall we?",anticipation,0,1,0,0,0,0,0,0
1016,4167,"For you, Lady Jane.",Neutral,0,0,0,0,0,0,0,0
1017,4169,Do you have anything with pants?,Neutral,0,0,0,0,0,0,0,0
1018,4172,Pants?,Neutral,0,0,0,0,0,0,0,0
1019,4173,Never mind. These will be fine. Thank you.,Neutral,0,0,0,0,0,0,0,0
1020,4175,"- Yes, milady. - There's Jane.",Neutral,0,0,0,0,0,0,0,0
1021,4178,All right.,Neutral,0,0,0,0,0,0,0,0
1022,4181,"Here's the deal, tubby.",anticipation,0,1,0,0,1,0,1,1
1023,4182,"You're gonna charm her, and I'm gonna poke her with this thing...",anticipation,0,1,0,0,0,0,0,0
1024,4185,"and extract the Reality Stone, and get gone lickety-split.",anger,1,0,0,0,0,0,0,0
1025,4189,"I'll be right back, okay? The wine cellar is just down here.",anger,1,0,1,1,0,1,0,0
1026,4192,My father used to have this huge barrel of Aakonian ale.,trust,0,0,0,0,0,0,0,1
1027,4195,I'll see if the scullery has a couple of to-go cups.,anger,1,0,1,1,0,1,0,0
1028,4197,Hey. Hey! Aren't you drunk enough already?,Neutral,0,0,0,0,0,0,0,0
1029,4206,"- If you could send Loki some soup. - Yes, milady.",Neutral,0,0,0,0,0,0,0,0
1030,4208,And ask our librarians to pull some volumes from the astronomy shelf.,Neutral,0,0,0,0,0,0,0,0
1031,4218,Who's the fancy broad?,anticipation,0,1,0,0,1,0,0,0
1032,4221,That's my mother.,anticipation,0,1,0,0,1,1,0,1
1033,4223,She dies today.,fear,0,0,0,1,0,1,0,0
1034,4226,"Oh, that is today?",Neutral,0,0,0,0,0,0,0,0
1035,4234,I can't do this. I can't do this.,Neutral,0,0,0,0,0,0,0,0
1036,4237,I shouldn't be here. I shouldn't have come.,Neutral,0,0,0,0,0,0,0,0
1037,4239,It's a bad idea!,anger,1,0,1,1,0,1,0,0
1038,4240,"- Come here. - No, no, no.",Neutral,0,0,0,0,0,0,0,0
1039,4241,I think I'm having a panic attack.,fear,1,0,0,2,0,0,0,0
1040,4244,- Come here. Right here. - I shouldn't be here. This is bad.,anger,1,0,1,1,0,1,0,0
1041,4247,You think you're the only one who lost people?,anger,1,0,1,1,0,1,1,0
1042,4248,What do you think we're doing here?,Neutral,0,0,0,0,0,0,0,0
1043,4251,I lost the only family I ever had.,anger,1,0,1,1,0,1,1,0
1044,4253,"Quill, Groot, Drax, the chick with the antenna...",Neutral,0,0,0,0,0,0,0,0
1045,4255,all gone.,Neutral,0,0,0,0,0,0,0,0
1046,4258,I get you miss your mom...,Neutral,0,0,0,0,0,0,0,0
1047,4259,but she's gone.,Neutral,0,0,0,0,0,0,0,0
1048,4261,Really gone.,Neutral,0,0,0,0,0,0,0,0
1049,4262,And there are plenty of people who are only kind of gone...,joy,0,0,0,0,1,0,0,1
1050,4265,and you can help them.,Neutral,0,0,0,0,0,0,0,0
1051,4267,"So, is it too much to ask that you brush the crumbs out of your beard...",Neutral,0,0,0,0,0,0,0,0
1052,4271,make schmoopy talk to Pretty Pants...,anticipation,0,1,0,0,1,0,0,1
1053,4274,"and when she's not looking, suck out the Infinity Stone...",anger,1,1,0,0,1,0,0,1
1054,4277,and help me get my family back?,Neutral,0,0,0,0,0,0,0,0
1055,4280,Okay.,Neutral,0,0,0,0,0,0,0,0
1056,4281,Are you crying?,sadness,0,0,0,0,0,1,0,0
1057,4283,No.,Neutral,0,0,0,0,0,0,0,0
1058,4286,Yes.,Neutral,0,0,0,0,0,0,0,0
1059,4287,I feel like I'm losing it.,anger,1,0,1,1,0,1,1,0
1060,4289,Get it together!,Neutral,0,0,0,0,0,0,0,0
1061,4290,You can do this.,Neutral,0,0,0,0,0,0,0,0
1062,4292,You can do this.,Neutral,0,0,0,0,0,0,0,0
1063,4296,All right?,Neutral,0,0,0,0,0,0,0,0
1064,4298,"Yes, I can.",Neutral,0,0,0,0,0,0,0,0
1065,4299,Good.,anticipation,0,1,0,0,1,0,1,1
1066,4302,I can do this. I can do this.,Neutral,0,0,0,0,0,0,0,0
1067,4305,I can't do this.,Neutral,0,0,0,0,0,0,0,0
1068,4307,"All right, heartbreaker, she's alone. This is our shot.",anger,1,0,0,1,0,0,0,0
1069,4310,Thor? Thor!,Neutral,0,0,0,0,0,0,0,0
1070,4323,"All right, bring it down, Blue.",sadness,0,0,0,0,0,1,0,0
1071,4325,"Right on that line. That's it. Down, down.",Neutral,0,0,0,0,0,0,0,0
1072,4332,"Hey, can we hurry it up?",anticipation,0,1,0,0,0,0,0,0
1073,4334,"Guys, chop-chop. Come on. We're on the clock.",anticipation,0,1,0,0,0,0,0,0
1074,4336,All that is really helpful.,joy,0,0,0,0,1,0,0,1
1075,4340,"- Take care, okay? - Yeah.",Neutral,0,0,0,0,0,0,0,0
1076,4342,Get that stone and come back. No messing around.,anger,1,0,1,0,0,0,0,0
1077,4345,- Hey. - We got this.,Neutral,0,0,0,0,0,0,0,0
1078,4346,"- Let's get it done. - Yes, sir.",trust,0,0,0,0,0,0,0,1
1079,4348,I'll see you back.,anger,1,0,1,1,0,1,0,0
1080,4350,You guys watch each other's six.,anticipation,0,1,0,1,0,0,0,0
1081,4352,Yeah.,Neutral,0,0,0,0,0,0,0,0
1082,4362,Coordinates for Vormir are laid in.,Neutral,0,0,0,0,0,0,0,0
1083,4365,All they have to do is not fall out.,sadness,0,0,0,0,0,1,0,0
1084,4373,We're a long way from Budapest.,anticipation,0,1,0,0,0,0,0,0
1085,4380,"Okay, so...",Neutral,0,0,0,0,0,0,0,0
1086,4383,we just wait around for this Quill guy to show up...,anticipation,0,1,0,0,0,0,0,1
1087,4386,"and then he leads us to the Power Stone, is that it?",anger,1,0,0,0,0,0,0,0
1088,4389,Let's take cover.,trust,0,0,0,0,0,0,0,1
1089,4392,We're not the only ones in 2014 looking for the stones.,anger,1,0,0,0,0,0,0,0
1090,4395,Wait a minute. What are you talking about right now?,anticipation,0,1,0,0,0,0,0,0
1091,4396,Who else is looking for these stones?,anger,1,0,0,0,0,0,0,0
1092,4401,My father...,trust,0,0,0,0,0,0,0,1
1093,4403,my sister...,Neutral,0,0,0,0,0,0,0,0
1094,4405,and me.,Neutral,0,0,0,0,0,0,0,0
1095,4406,And you?,Neutral,0,0,0,0,0,0,0,0
1096,4409,Where are you right now?,Neutral,0,0,0,0,0,0,0,0
1097,4439,You're welcome.,Neutral,0,0,0,0,0,0,0,0
1098,4440,I didn't ask for your help.,Neutral,0,0,0,0,0,0,0,0
1099,4443,"And yet, you always need it.",Neutral,0,0,0,0,0,0,0,0
1100,4449,Get up. Father wants us back on the ship.,anticipation,0,1,0,0,0,0,0,1
1101,4451,Why?,Neutral,0,0,0,0,0,0,0,0
1102,4452,He's found an Infinity Stone.,anger,1,1,0,0,1,0,0,1
1103,4459,Where?,Neutral,0,0,0,0,0,0,0,0
1104,4461,On a planet called Morag.,Neutral,0,0,0,0,0,0,0,0
1105,4464,Father's plan is finally in motion.,anticipation,0,3,1,0,1,0,1,2
1106,4466,"One stone isn't six, Nebula.",anger,1,0,0,0,0,0,0,0
1107,4468,It's a start.,anticipation,0,1,0,0,0,0,0,0
1108,4470,If he gets all of them...,Neutral,0,0,0,0,0,0,0,0
1109,4484,Ronan's located the Power Stone. I'm dispatching you to his ship.,anger,1,1,0,0,0,0,0,0
1110,4488,He won't like that.,anticipation,0,1,0,0,0,0,0,0
1111,4489,His alternative is death.,anger,1,1,1,1,0,1,1,0
1112,4493,Ronan's obsession...,Neutral,0,0,0,0,0,0,0,0
1113,4496,clouds his judgment.,surprise,0,0,0,0,0,0,1,0
1114,4502,"We will not fail you, Father.",trust,0,0,0,0,0,0,0,1
1115,4505,"No, you won't.",anticipation,0,1,0,0,0,0,0,0
1116,4510,I swear...,trust,0,0,0,0,0,0,0,1
1117,4513,I will make you proud.,anticipation,0,1,0,0,1,0,0,1
1118,4523,We just wait around for this Quill guy to show up...,anticipation,0,1,0,0,0,0,0,1
1119,4527,"and then he leads us to the Power Stone, is that it?",anger,1,0,0,0,0,0,0,0
1120,4529,Let's take cover.,trust,0,0,0,0,0,0,0,1
1121,4531,We're not the only ones in 2014 looking for the stones.,anger,1,0,0,0,0,0,0,0
1122,4537,Who was that?,Neutral,0,0,0,0,0,0,0,0
1123,4538,I don't know.,Neutral,0,0,0,0,0,0,0,0
1124,4539,My head is splitting. I don't know.,Neutral,0,0,0,0,0,0,0,0
1125,4543,Her synaptic drive was probably damaged in battle.,anger,2,0,1,0,0,1,0,0
1126,4556,Bring her to my ship.,anticipation,0,1,0,0,0,0,0,0
1127,4566,"Better hustle, Cap.",anticipation,0,1,0,0,0,0,0,1
1128,4567,Things look like they're just about wrapped up here.,Neutral,0,0,0,0,0,0,0,0
1129,4569,Got it. I'm approaching the elevator now.,Neutral,0,0,0,0,0,0,0,0
1130,4577,If it's all the same to you...,Neutral,0,0,0,0,0,0,0,0
1131,4581,I'll have that drink now.,anger,1,0,1,1,0,1,0,0
1132,4583,"All right, get him on his feet.",Neutral,0,0,0,0,0,0,0,0
1133,4585,We can all stand around posing up a storm later.,anger,1,0,0,0,0,0,0,0
1134,4588,"By the way, feel free to clean up.",joy,0,0,0,0,1,0,0,1
1135,4590,"Mr. Rogers, I almost forgot that that suit...",Neutral,0,0,0,0,0,0,0,0
1136,4593,did nothing for your ass.,Neutral,0,0,0,0,0,0,0,0
1137,4595,"No one asked you to look, Tony.",Neutral,0,0,0,0,0,0,0,0
1138,4596,"- It's ridiculous. - I think you look great, Cap.",anger,1,1,1,0,0,0,0,1
1139,4598,"As far as I'm concerned, that's America's ass.",Neutral,0,0,0,0,0,0,0,0
1140,4601,Who gets the magic wand?,Neutral,0,0,0,0,0,0,0,0
1141,4603,S.T.R.I.K.E. team's coming to secure it.,anger,1,0,0,0,0,0,0,1
1142,4615,We can take that off your hands.,Neutral,0,0,0,0,0,0,0,0
1143,4617,By all means.,Neutral,0,0,0,0,0,0,0,0
1144,4620,Careful with that thing.,Neutral,0,0,0,0,0,0,0,0
1145,4622,"Yeah, unless you want your mind erased.",fear,0,0,0,1,0,0,0,0
1146,4624,And not in a fun way.,anticipation,0,1,0,0,1,0,0,0
1147,4625,We promise to be careful.,joy,0,0,0,0,1,0,0,1
1148,4626,Who are these guys?,Neutral,0,0,0,0,0,0,0,0
1149,4627,They are S.H.I.E.I.D.,Neutral,0,0,0,0,0,0,0,0
1150,4629,"Well, actually Hydra, but we didn't know that yet.",fear,0,0,0,1,0,0,0,0
1151,4632,Seriously? You didn't?,Neutral,0,0,0,0,0,0,0,0
1152,4635,"I mean, they look like bad guys.",anger,1,0,1,1,0,1,0,0
1153,4636,"You're small, but you're talking loud.",Neutral,0,0,0,0,0,0,0,0
1154,4638,On my way down to coordinate search and rescue.,anticipation,0,1,0,0,1,0,1,1
1155,4640,On my way down to coordinate search and rescue.,anticipation,0,1,0,0,1,0,1,1
1156,4642,"I mean, honestly, how do you keep your food down?",joy,0,0,0,0,1,0,0,1
1157,4645,Shut up.,Neutral,0,0,0,0,0,0,0,0
1158,4647,"All right, you're up, little buddy.",anticipation,0,1,0,0,1,0,0,1
1159,4648,There's our stone.,anger,1,0,0,0,0,0,0,0
1160,4650,All right.,Neutral,0,0,0,0,0,0,0,0
1161,4651,Flick me.,Neutral,0,0,0,0,0,0,0,0
1162,4667,- Move. - Hey.,Neutral,0,0,0,0,0,0,0,0
1163,4668,"Hey, hey. Buddy!",anticipation,0,1,0,0,1,0,0,1
1164,4670,What do you think? Maximum occupancy has been reached.,Neutral,0,0,0,0,0,0,0,0
1165,4672,Take the stairs.,Neutral,0,0,0,0,0,0,0,0
1166,4673,"Yeah. Stop, stop.",Neutral,0,0,0,0,0,0,0,0
1167,4678,"""Take the stairs."" Hate the stairs.",anger,1,0,1,1,0,1,0,0
1168,4684,"All right, Cap, I got our scepter in the elevator...",anticipation,0,1,0,0,0,0,0,1
1169,4687,just passing the 80th floor.,Neutral,0,0,0,0,0,0,0,0
1170,4689,On it.,Neutral,0,0,0,0,0,0,0,0
1171,4691,"- Head to the lobby. - All right, I'll see you there.",anger,1,0,1,1,0,1,0,0
1172,4693,Evidence secure.,Neutral,0,0,0,0,0,0,0,0
1173,4695,We're en route to Doctor List.,trust,0,0,0,0,0,0,0,1
1174,4697,"No. No hitches at all, Mr. Secretary.",Neutral,0,0,0,0,0,0,0,0
1175,4705,Captain.,Neutral,0,0,0,0,0,0,0,0
1176,4706,I thought you were coordinating search and rescue.,anticipation,0,1,0,0,1,0,1,1
1177,4709,Change of plans.,anticipation,0,1,0,1,0,0,0,0
1178,4714,"Hey, Cap.",anticipation,0,1,0,0,0,0,0,1
1179,4717,Rumlow.,Neutral,0,0,0,0,0,0,0,0
1180,4724,I just got a call from the secretary.,Neutral,0,0,0,0,0,0,0,0
1181,4726,I'm gonna be running point on the scepter.,Neutral,0,0,0,0,0,0,0,0
1182,4730,Sir? I don't understand.,trust,0,0,0,0,0,0,0,1
1183,4735,We got word there may be an attempt to steal it.,anger,1,1,0,1,0,1,0,1
1184,4737,"Sorry, Cap.",anticipation,0,1,0,0,0,0,0,1
1185,4739,We can't give you the scepter.,Neutral,0,0,0,0,0,0,0,0
1186,4741,I'm gonna have to call the director.,trust,0,0,0,0,0,0,0,1
1187,4743,That's okay. Trust me.,trust,0,0,0,0,0,0,0,1
1188,4749,Hail Hydra.,fear,0,0,0,1,0,0,0,1
1189,4764,So many stairs!,Neutral,0,0,0,0,0,0,0,0
1190,4778,"Thumbelina, do you copy? I've got eyes on the prize.",Neutral,0,0,0,0,0,0,0,0
1191,4781,It is go time.,anticipation,0,1,0,0,0,0,0,0
1192,4782,Bombs away.,anger,1,0,0,1,0,1,1,0
1193,4790,Is that Axe Body Spray?,Neutral,0,0,0,0,0,0,0,0
1194,4793,"Yeah, I had a can in the desk for emergencies. Relax.",Neutral,0,0,0,0,0,0,0,0
1195,4795,"Can we focus, please?",Neutral,0,0,0,0,0,0,0,0
1196,4796,I'm going inside you...,Neutral,0,0,0,0,0,0,0,0
1197,4798,now.,Neutral,0,0,0,0,0,0,0,0
1198,4805,May I ask you where you're going?,Neutral,0,0,0,0,0,0,0,0
1199,4807,"Bit of lunch and then Asgard. I'm sorry, you are...?",Neutral,0,0,0,0,0,0,0,0
1200,4809,Alexander Pierce.,Neutral,0,0,0,0,0,0,0,0
1201,4810,He's the man above the folks behind Nick Fury.,anger,1,0,0,1,0,1,0,0
1202,4813,My friends call me Mr. Secretary.,Neutral,0,0,0,0,0,0,0,0
1203,4814,I'm gonna have to ask you to turn that prisoner over to me.,anger,1,0,1,1,0,1,0,0
1204,4817,Loki will be answering to Odin himself.,Neutral,0,0,0,0,0,0,0,0
1205,4819,"No, he's going to answer to us. Odin can have what's left.",sadness,0,0,0,0,0,1,1,0
1206,4821,And I'm gonna need that case.,fear,0,0,0,1,0,1,0,0
